<?xml version="1.0" encoding="UTF-8"?>

<Students xmlns:xsi ="http://www.w3.org/2001/XMLSchema-instance"  xsi:noNamespaceSchemaLocation="task2.xsd">
 
	<Student sid="a">
	<name>venkat</name>
		<email>ramanav9347@gmail.com</email>
		<marks>24</marks>
		<class>2</class>
	</Student>
	<Student sid="b">
		
		<name>ramana</name>
		<email>remiremi89@gmail.com</email>
		<marks>24</marks>
		<class>4</class>
	</Student>
	<Student sid="c">
		
		<name>suhas</name>
		<email>anav9347@gmail.com</email>
		<marks>25</marks>
		<class>5</class>
	</Student >
	<Student  sid="d">
		
		<name>manikanta</name>
		<email>manaikanatav9347@gmail.com</email>
		<marks>24</marks>
		<class>6</class>
	</Student>
	<Student sid="e">
		
		<name>pavan</name>
		<email>pavanv9347@gmail.com</email>
		<marks>23</marks>
		<class>7</class>
	</Student>
</Students>